Stock Code,Company,Update time,Author,Texts,Likes,Comments,情绪得分,URL
NIO,蔚来,2024/4/8 23:31, 开六,换电有点充电宝的意思？也就是在一些特定时候更方便！,0,1,6,https://xueqiu.com/S/NIO
NIO,蔚来,2024/4/8 22:39, 牛唐,医药板块速评（2024.04.05）1、AACR医药大会召开，哪些公司值得关注？2、大额私募增发，后续走势如何看？3、、、蔚来(NIO)、壳牌(SHEL)期权大量成交，后续走势如何看？,1,0,5.5,https://xueqiu.com/S/NIO
NIO,蔚来,2024/4/8 21:40, 金融界网站,4月8日，蔚来(NIO)开盘上涨2.16%，截至21:32，报4.49美元/股，成交2235.91万美元。财务数据显示，截至2023年12月31日，蔚来收入总额556.18亿人民币，同比增长12.89%；归母净利润-211.47亿人民币，同比减少45.25%。,0,0,5.5,https://xueqiu.com/S/NIO
NIO,蔚来,2024/4/8 21:09, 金属疯子,单次续航1000+公里，仅仅就是象征意义?蔚来汽车首台 150kWh电池包预计二季度量产，目前国内乘用车最大电池包，单次续航1055km。李斌说：“150度电池包的象征意义大于实际意义，因为没有人会一口气开车1000公里，完善基础设施的意义要更大，150度电池包可能去人迹罕至的地方才有用处，它就解决了1%的场景问题，日常生活中的意义没有那么大”1.话说得对，这么长的续航，日常生活中的意义没有那么大。2.更对的是，完善基础设施的意义要更大3.但：不管是象征意义还是实际意义，都是意义4..而且：单次1055km的续航，解决了1%的场景问题，绝对不仅仅是象征意义5.确实：没人一次性主动开1000km。6.如果是被动的情况下，变相的需要开1000km呢（冰天雪地堵在高速）？7.电动车最被担心的就是续航冗余，多一点续航就少一点焦虑，多一点安心。这是电车普及最大的门槛之一。8.1000km意味着大部分的极端场景下，电车能够带车主去到目的地，或者至少去到补能点。9.摆脱对基础设施的强依赖，单车救主。10.所以，这个绝对不仅仅是象征意义了。斌哥，这次有点凡尔赛啊。我甚至在想，换做别的品牌会怎么宣传这件事。,1,1,5,https://xueqiu.com/S/NIO
NIO,蔚来,2024/4/8 18:43, 花长老,如果9系市场不认可，那蔚来的麻烦可就大了。纯感觉，9系成功率很低。,1,0,2.5,https://xueqiu.com/S/NIO
NIO,蔚来,2024/4/8 18:11, 经观汽车, 摘要：造车新势力的多品牌之路能否走通？  文 | 周菊 蔚来、理想、小鹏，这三家被视为行业头部的新势力车企，曾创造了中国品牌向上攻入中高端豪华车市场的“奇迹”，而今它们却集体调头向下，以寻找新的市场机会。蔚来和小鹏都即将发布定位更低的第二品牌，理想也有推出低价车型的打算。“一上一下”之间，折射出造车新势力在当前阶段全新的思路和打法。 蔚来近日在一场媒体沟通会上宣告了第二品牌“乐道”即将诞生，预告新品牌将于五月上旬正式发布。蔚来创始人李斌表示，乐道成本会比特斯拉ModelY降低10%左右，按现款ModelY的指导价25.89万至36.39万元推算，乐道的起步价有望下探到23万元左右，这对于此前产品定价在30万至50万元的蔚来而言，是前所未有的“平民价”。 无独有偶，在今年的中国电动汽车百人会论坛（2024）上，小鹏汽车创始人何小鹏宣布，小鹏汽车将发布全新品牌，正式进军10万―15万元级汽车市场，新品牌将在北京车展亮相，首款车型预计第三季度上市。对于主打20万元以上车型的小鹏汽车而言，这也将是一次价格“大跳水”。 理想虽未急于“另立门户”，但从其产品线与定价策略的步步下探趋势中，同样能窥见其对低价市场的野心。消息显示，理想第一款30万元以下的车型理想L6即将于今年4月正式上市。 一时间，曾以高端市场为主要发展方向的“蔚小理”，不约而“自降身份”，将目光投向了中低端市场。“第二波自主品牌似乎正在重复第一波自主品牌（吉利、长城、长安等）走过的路，从母品牌发展出多个子品牌，涵盖多个细分市场，以期提升销量和市占率。”汽车行业资深分析师梅松林对经济观察报记者表示。 造车新势力的多品牌之路能否走通？德勤中国汽车行业主管合伙人周令坤指出，新造车企业推出子品牌将面临诸多挑战，包括：子品牌可能稀释母品牌的高端光环；内部品牌间可能出现相互蚕食的内耗现象；在与比亚迪等传统大厂的成本控制较量中优势不明显，因此，这些子品牌能否在市场上取得成功，目前还难下定论。 集体转向 蔚来向来是最坚定的高端派捍卫者。“十几万的市场很多中国的品牌做得已经挺好的，也不缺我们一家，但在主流高端市场（30万―50万区间）没有中国品牌立得住，总得有人去挑战，我们就来干这个事。”李斌在2019年底举行的NIODay上明确表示，蔚来不会做特别便宜的车。 在李斌眼中，高端市场不仅意味着可以取得更为丰厚的利润，还有利于前沿技术的创新和应用，其对标对象始终是德系豪华三巨头BBA（奔驰、宝马、奥迪）。为了打造品牌的豪华感，蔚来不惜斥巨资在全国布局NioHouse，传闻称位于北京东方广场的蔚来中心，仅年租金就高达8千万元。同时，为提升产品的豪华感和用户的尊贵感，蔚来为每个用户标配一对一的VIP级售后服务。 在高端市场摸爬滚打了十年之后，蔚来的品牌形象在中高端市场初步立住了脚，在销量上却始终无法快速上量。在做高端的梦想与持续亏损的现实之间，蔚来选择通过新品牌“乐道”来扩大市场覆盖和规模。在近期的蔚来2023年度财报会上，李斌强调：“2024年，我们首要任务是让面向大众市场的新品牌实现增长。” 蔚来推低价品牌的计划可以追溯到几年前。早在2021年，就有传闻称蔚来在做内部代号为“阿尔卑斯”的项目，也即现在已公布正式名称的“乐道”品牌。除了乐道，蔚来还计划推出第三品牌――内部代号为“萤火虫计划”。这一品牌将瞄准10万―20万元区间。在蔚来内部，三大品牌被视为如丰田集团内“雷克萨斯、丰田、铃木”的阶梯式矩阵。由此，蔚来向低价市场要销量的野心展露无遗。 与蔚来一向高调打造高端品牌形象不同，小鹏汽车实际上是从较为低端的车型小鹏G3起步的，其虽然未明确表明只做高端市场，但从企业和产品的发展趋势看，小鹏汽车同样怀揣高端梦。在前期打开市场后，小鹏汽车逐渐将重心转移到价格更高的P系列车型，G3则黯然退场。同时，小鹏产品的价格带稳步上扬，最新力作MPV小鹏X9价格突破了40万元大关。 但小鹏同样无法凭借现有的产品实现规模效应，其与蔚来一样，采用了推出新品牌的做法。2023年8月，小鹏宣布与滴滴达成战略合作，表示将推出全新品牌，项目代号为“MONA”。而在“MONA”之外，小鹏汽车似乎还有更多的品牌计划。何小鹏曾表示，“MONA这个平台对小鹏来说是第二品牌甚至第三品牌的开始”。 理想汽车目前未明言是否会启动多品牌战略，但从其产品规划中却能嗅到下探至中端市场的气息。据行业消息称，理想即将推出的L6车型，售价将首次低于30万元大关，一改过往全系车型坚守30万元以上的定价传统。从L9的45万元，MEGAMPV的56万元，到L6的30万元以下的定价，理想正尝试以价格杠杆撬动更广阔的市场需求。 多重压力下的选择 蔚来、小鹏推出低价品牌的首要目标，是扩大企业的市场规模。“单一品牌能够触达的客群体量是有天花板的，孵化或是收购子品牌能够帮助车企触达不同的细分市场、价格区间和消费群体，例如乐道能让蔚来的价格区间下探到20万―30万元，MONA能让小鹏打入15万元以内的细分市场。”周令坤表示，从理论上看，子品牌的推出有助于造车新势力企业扩大市场规模。 当前，虽然国内的高端化市场仍呈现增长态势，但最大的市场份额还在30万元以下的价格带。根据中国汽车工业协会发布的最新数据，今年2月，15万―20万元新能源汽车销量占比达24.6%，其次是35万―40万元，占比16.9%。 坚持走高端路线的“蔚小理”，在市场上刷出了不少存在感，但在销量方面收获不大。数据显示，2023年蔚来汽车销售16万辆，小鹏汽车销售14.2万辆，两者均未达到20万辆的年销目标。作为对比，比亚迪2023年月均销量达到25万辆。即便是“蔚小理”当中销量表现最好的理想汽车，其去年的月均销量达到3万辆，但仍远不及比亚迪和特斯拉。数据显示，比亚迪2023年年销量超过300万辆，全年利润超过300亿元。 因规模效应未能达成，蔚来和小鹏等新造车企业迟迟无法实现盈利，亏损持续扩大。数据显示，2023年蔚来净亏损达207.2亿元，比上年亏损扩大62.83亿元。小鹏汽车2023年净亏损103.8亿元，同比扩大13.6%。 周令坤表示，蔚来和小鹏推出子品牌的底层原因还是降低成本，减少亏损，推进盈利进程。“蔚来和小鹏的年销都没摸到20万辆的门槛，建立子品牌允许车企的研发投入、采购成本、制造成本、销售管理费用等尽可能地实现摊销。”周令坤指出。 梅松林同样认为，新造车企业推出子品牌有助于快速改善财务表现。“新创车企价值链一旦形成，再推出一个新品牌的边际成本相对较低，可以充分利用已有的技术、平台、生产、营销、渠道服务能力。通过多品牌覆盖多个细分市场，可以有效提升销量、增加市占率，以期最终快速改善财务表现。”梅松林表示。 早在2022年初，李斌就曾表示“希望蔚来在2024年盈利”。到了2023年一季度的财务电话会上，李斌指出盈亏平衡的时间点肯定会往后推，至于推迟的时间，蔚来希望不超过一年，也就是最晚2025年要实现。何小鹏此前也表示，小鹏汽车预计在2025年实现盈亏平衡。这意味着，留给蔚来和小鹏实现盈利目标的时间只有两年，向份额更大的低价市场进军成为两者共同的选择。 再者，从市场竞争的角度看，当前新能源汽车竞争变得越来越激烈，传统车企的新品牌来势凶猛，问界、极氪、深蓝等其他新势力车企都在迅速上量，“蔚小理”必须迎战。如今，造车新势力阵营中不断有玩家被“淘汰”，如威马汽车倒闭，高合汽车陷入停工停产。面对新的战局，扩大市场覆盖面活下来成了造车新势力的首要任务。 在“蔚小理”三家企业中，理想的销量和财务表现是最好的，不过目前也遇到了困难。在市场上，今年来，理想汽车的月销量数次被问界赶超。同时，理想的首款纯电MPV车型MEGA因定价、配置、造型等原因，市场受挫并引发理想汽车内部反思。在这种情况下，理想汽车不得不向下要销量。据悉，理想L6的目标是挑战月销3万辆，这几乎是理想目前的总月销量。 多品牌之路能否走通 从当前的市场格局看，新能源汽车市场还未固化，新造车企业推出低价品牌有一定的成功概率。周令坤指出，当前车市中，10万―20万元的市场份额最大，占据新车近一半的销量，但新能源的渗透率还相对较低，仅在22%左右。新势力下探到这一区间，仍具备较大潜力和机会，新势力可以将智驾等先进技术通过子品牌下探到低价市场，攫取市场份额。 周令坤同时指出，新造车企业推出子品牌的做法也面临诸多挑战。首先，推出新品牌可能对原有品牌的品牌形象和品牌价值造成稀释风险。在推出子品牌之前，蔚来、小鹏等新造车企业投入巨资将品牌形象和品牌价值提升到了较高的位置，但较为低价的子品牌可能会稀释好不容易建立起来的品牌形象，进而造成企业形象模糊。 其次，推出子品牌有可能引发企业的内部消耗。以蔚来为例，根据其对外释放的消息，新品牌“乐道”也将利用一部分蔚来品牌的售后体系，并且为了支持新品牌，蔚来计划从2024年4月份开始布局第四代换电站，以兼容蔚来和乐道两个品牌。但如果蔚来给NIO和乐道提供的是同样的售后服务和换电服务，就有消费者可能会在蔚来品牌和乐道品牌之间选择后者。“如果品牌定位不清晰，或者定价及服务过于接近主品牌，就会形成内部牵制，且多品牌和多车型也不利于创造爆品。”周令坤指出，多品牌运营需要企业对每个品牌的定位、营销策略等进行精准把握，否则容易出现品牌之间相互冲突，形成踩踏效应。 再者，在资金和成本控制方面，新品牌的推出可能将加快企业“烧钱”的速度，让本来就已经承压的财务状况变得雪上加霜。 更为严峻的是，在低价格段的新能源汽车市场内，已经有比亚迪、吉利等传统大厂把守，加上自带流量的小米汽车入局，新造车企业子品牌将面临“多方夹击”的不利局面。“传统车企新能源具有规模化、垂直整合、渠道网络等多重优势，新势力一旦进入下沉市场，一定会有一场硬仗要打。”周令坤指出。 在汽车行业，车企采用多品牌运营策略早已不是新鲜事，不少国内外车企都走过这样的路，“蔚小理”则是第一次这样做。国际企业层面，大众集团旗下有十多个品牌，丰田旗下有雷克萨斯，通用汽车旗下有凯迪拉克、别克、雪佛兰几个品牌。国内的比亚迪、吉利、长城、长安等车企，目前也都建立了多品牌的品牌结构。 从结果来看，并非每一家企业的多品牌战略都能取得成功。对于新造车企业来说，实现规模效应和提升盈利是摆在眼前的迫切任务，走向多品牌之路是它们做出的共同途径，但这条路的前方充满了未知。  ,0,0,5.5,https://xueqiu.com/S/NIO
NIO,蔚来,2024/4/8 14:54, 1号车盟V,进入二季度之后，细看车市混战状况，只能感叹没有最狠，只有更狠。四月份第一天，国内车企再次开启全新一个季度的较量，单4月1日一天，为了帮自家品牌赚吆喝，已经有9家车企以不同的形式加入车市价格战。原本对比燃油车，新能源车还有点“拿腔拿调”，降价力度和表现远不如燃油车，如今来看，新能源车也快要崩不住了，不管销量高低，都无一幸免加入价格战。只是这降价是实打实地降，还是搞噱头，还需仔细辨别。真销冠，假降价？4月份打响降价第一枪正是问界，其开启降价的也正是问界品牌的主力车型问界新M7。看到这里不少人都疑惑住了，因为按常理来说，销冠搞降价还是相当少见的。毕竟风头正盛，后劲又足，这时候降价不就等于自己砍利润点吗？根据3月份问界汽车公布的数据显示，3月份问界累计交付新车31727辆，环比增长33%，位于新势力销量榜单第一，而问界新M7的交付量达到了24598辆，占比品牌总销量的75%以上，也是目前交付量最高的新势力单一车型。不仅如此，今年1月份，问界新M7的销量达到了29997辆，2月份达到了21083辆，也就是说，2024年以来，问界新M7的销量月均都在2万辆以上，一季度单一车型累计销量要比其他新势力品牌全系车型加起来还多，这时候搞降价实在是令人匪夷所思。降价后，现款问界M7的入门版车型在4月30日前支付定金可以享受2万元现金优惠，优惠后起售价降至22.98万元，此外，五座和六座的后驱智驾版和四驱智驾版也都降价了1万元整。不过很快有人发现，降价2万元的问界M7看似力度很大，实则羊毛出在羊身上。降价2万元的问价M7 Plus五座后驱版去掉了包含HUD、水晶挡把、电吸门和主驾头枕音响在内的价值1.5万元的科技舒享包，这一来一回，实际降价也就5000元。看来想让销冠降价还是有点难度的，问界新M7此次降价，总的来说是噱头大于实际，估计是小降个五千当宣传费了。死鸭子嘴硬，不说降价，但花样降那比起降价力度远不如降价噱头的问界来说，蔚来算是另一个极端了，按蔚来的说法就是，它们不降价。想必大家对3月份蔚来通过降低BaaS方案的价格来参与价格战还有点印象，4月份蔚来又整出新活儿了。日前，蔚来宣布推出最高10亿元的油车置换补贴，即日起油车的用户置换蔚来2024款的新车在现有政策外将额外获得1万元的选装基金补贴，且结合其他利于政策，油车用户置换蔚来还可获得最高1.5万元的选装基金、一年全域领航辅助使用权、NIO Phone优惠券和换电券等权益。结合3月份销量来看，3月份蔚来共售出新车11866万辆，逆转前两个月的局势，有所上升，整个一季度蔚来共售出新车30053辆，在整个新能源车市场销量榜单处于中下游的水平，始终不温不火。当然蔚来销量的桎梏很大程度上来自其高昂的售价，此次油车置换最高10万元的补贴还是相当有吸引力的，而且蔚来采用的换电模式，对于长期习惯开油车的车主来说，接受难度也比较小，作为油车车主的第一款新能源车是很不错的选择。一直卖不出去，一直降要说小鹏汽车和降价的渊源那可是颇深，几乎在每一次降价中都能看到它的身影，即使有小鹏X9的出现为小鹏贡献了销量，但基于MPV车型的特性，效果仍有限。3月份，小鹏P7鹏翼版已经在三月底上市的时候推出了4万元的优惠政策，旗下的G9也给出了全系五千到一万元的优惠力度，降价后售价来到了25.39万元-35.49万元。虽然降价后也给小鹏的市场销量带来了正向的表现，3月份小鹏的交付量环比上涨99%，但实际上新车销量仅9026辆，还未破万，低于一众新能源品牌，可以用未达预期来形容。而四月份，小鹏再次对旗下G9推出优惠政策，这次优惠金额直接加码到了2万元，该车起售价直接来到了24.39万元。此外，小鹏G9还推出了星际绿和星阙灰车漆和双腔空气悬架限时5折选装优惠。目前来看，小鹏的前路还是相当艰难的，降价是实打实的，卖不出去也是实打实的，而且降价这招用多了，用户都失去新鲜感了，总想着下个月还能再降两万，不着急。被逼无奈，只能降要说此次降价降得最不情不愿的估计就是极氪了，面对小米SU7的攻势，极氪“表面上稳如老狗，实则内心慌得一批”。在推出上市价格就相当有诚意的全新极氪001后，极氪紧随小米SU7，又推出了降价增配版的极氪007后驱增强版，75度电后驱版本起售价20.99万元，还新增了前后排电动调节、座椅加热等功能，并新增智能香氛系统、21扬声器音响、AR-HUD、向日葵屏等舒适配置，主打的就是想用高配置“砸晕”用户，友商不是配置不错吗？极氪要比它更强。不过目前来看，在产品声量上，极氪是完败小米的，至于极氪007降价增配后能不能抢过小米的风头，目前仍旧是存疑的，且看后续4月的销量情况到底如何吧。写在最后总的来看，四月份这波降价还是十分有趣的，有人说降不真降、有人真降不说降、有人真降可能还得降、有人无奈得真降。要小编来说，降价，只有那些真正有销量危机感的品牌才会动真格，至于那些销量还过得去的品牌，它们要说降价，听听就得了。,0,0,5,https://xueqiu.com/S/NIO
NIO,蔚来,2024/4/8 13:10, 易智财通,谁能想到？一夜之间，新能源汽车仿佛就只剩下中国一枝独秀不少人幸灾乐祸，说苹果、奔驰等巨头都退出“不玩了”，就我们玩对于新能源汽车到底是不是未来的回答最近，我在网上看到一段分析，觉得说得非常精辟智能电动汽车就好比是我们之前的电话先是有座机，然后有移动电话、手机，再然后才有智能手机这是技术发展的趋势，难不成我们还能退回到座机时代？让欧美破了大防的，要掀桌子不玩的根本原因，是中国车企已经技术领先，这其中很重要的一点就是技术专利以比亚迪、蔚来为代表中国新能源车企可是说干就干，这些年不断投入大量的真金白银比亚迪去年一年申请的专利超6700项，平均每个工作日拿27项蔚来去年的研发投入就超过134个亿，专利同样拿到手软，超过了8500项在那些欧美这些西方国家眼里，他们只允许自己拿着专利然后坐在家里，躺着收割全世界的专利费而一旦专利出现在我们手里，让他们交专利费不好意思，他们要掀桌子，开始叫嚣着：我不玩了，你们也不要玩了之前的5G、光伏产业就玩这一套，到了新能源汽车这里，还想这么玩这不就是赤裸裸的强盗逻辑？欧美集体重回油车老路，恰恰说明中国在新能源汽车领域的崛起和成功现在的我们现在有市场，有技术、有基础设施，还有比亚迪、蔚来、华为智选车等一大批优秀的新能源汽车品牌中国在全球汽车产业已经从过去的跟随者和追赶者，已华丽转身成优势者和引领者我们要做的，就是保持不断的创新和进步，继续推动全球汽车产业的转型升级现在有一些人别有用心，到处说中国新能源汽车是昙花一现，世界终究要回到燃油车时代估计，他们也很有可能是某些油车企业，为了维持自己的地位，请出来带节奏的就像最近罗永浩提到的，有些油车品牌雇人黑新能源品牌的人兄弟们，时代变了！靠嘴炮是攻不破中国在新能源汽车领域的坚固堡垒反而最终会被时代所淘汰,9,22,4.5,https://xueqiu.com/S/NIO
