Stock Code,Company,Update time,Author,Texts,Likes,Comments,情绪得分,URL
300750,宁德时代,45385.63889, 新能源主题ETF,"24年1-2月，我国锂电池出口金额同比-15%，出口数量同比+10%。根据中国海关，2024年1-2月，我国锂离子电池累积出口额为87.2亿美元，同比降低15%；我国锂离子电池累积出口数量为5.95亿个，同比增长10%。2022年以来，我国锂离子电池产品出口结构正在发生变化，消费类产品用锂离子电池数量在减少，而动力和储能用锂离子电池数量在快速增长。在原材料及锂电材料成本下降趋势中，24年1-2月，中国锂电池月度出口单价分别为14.2美元/个和15.4美元/个，相较23年同期有所下滑。本周行情回顾：本周（2024/3/25-2024/3/29）沪深300指数跌幅0.21%，其中电力设备下跌1.26%，跑输沪深300指数1.05pct，在31个申万一级行业中排名第21；本周申万电力设备二级行业中，电池涨幅靠前，上涨0.24%，电机跌幅靠前，下跌4.74%；截至2024年3月29日，今年以来申万电力设备指数累计下跌4.34%，跑输沪深300指数7.44pct。行业动态：本周产业链价格涨势放缓，碳酸锂价格小幅回落，电解钴、7um湿法基膜等环节价格小幅下降，当前产业链价格博弈较为浓厚，未来碳酸锂环节仍是决定电池企业成本压力的重要因素。光伏方面，本周硅料市场成交冷清，一线头部大厂对块料报价暂时未有明确下跌幅度，但二三线硅料企业的报价有相对更明显的下滑，颗粒硅价格也有发生下跌；本周硅片接续跌势，P型M10,G12尺寸成交价格来到每片1.7-1.9与2.3-2.5元人民币，N型M10,G12尺寸成交价格来到每片1.65-1.75与2.6-2.7元人民币左右，各规格跌幅达到3-9%不等，N型G12R（182*210mm）当前价格落在每片2.3元人民币不等；本周电池成交价格小幅下滑，P型M10尺寸落在每瓦0.37-0.38元人民币、G12尺寸成交价格也维持每瓦0.36-0.37元人民币，N型M10TOPCon电池片价格也出现松动，均价价格来到每瓦0.45-0.46元人民币左右；本周组件价格整体维稳，182PERC双玻组件约每瓦0.8-0.95元人民币，TOPCon组件约在每瓦0.85-1元人民币，其中集中式项目价格执行以每瓦0.86-0.93元人民币，而分布式项目在每瓦0.93-0.95元人民币的价格水平。公司动态：同享科技拟开展新业务；容百科技与SKOn签署《合作备忘录》。投资分析意见：锂电关注供给侧格局演化和新材料应用。中游电芯及锂电材料环节新建产能投资趋缓，1Q24价格竞争逐渐进入尾声，24年行业变化重点关注份额变动，看好价格战下份额逆势提升的头部企业（电池、负极和结构件环节）。继续关注新技术和海外市场。4C快充24年有望加速渗透至10-20万车型，对应负极包覆材料、导电炭黑及硅基负极等需求提升较大。欧美电池产能有望于24-26年逐年落地，核心关注国内锂电供应链海外进程。光伏行业当下正处于大浪淘沙的阶段，未来板块的大贝塔行情将一去不复返，当产业由扩张期向成熟期过渡，留下来的将是真正有实力的企业。未来能在光伏领域留下来的企业我们认为一定是在技术创新和成本控制这两个方面做到十分突出的，推荐关注BC电池环节爱旭股份、硅料环节通威股份。风险提示：1）政策实施效果不达预期的风险；2）竞争激烈导致价格超预期下降的风险；3）技术路线快速变化的风险。文章来源：申万宏源免责声明：转载内容仅供读者参考，版权归原作者所有，内容为作者个人观点，不代表其任职机构立场及任何产品的投资策略。本文只提供参考并不构成任何投资及应用建议。如您认为本文对您的知识产权造成了侵害，请立即告知，我们将在第一时间处理。",0,0,5,https://xueqiu.com/k?q=宁德时代
300750,宁德时代,45385.63194, 小米集团主连(MIUmain),"来源：雪球App，作者： 小米集团主连(MIUmain)，（https://xueqiu.com/-1/284732319）同花顺（300033）金融研究中心04月03日讯，有投资者向和胜股份（002824）提问， 董秘，您好。最近小米汽车的发布已经公布了电池使用的是宁德时代（300750）的三元锂电池以及比亚迪（002594）的刀片电池，贵公司一直是宁德时代和比亚迪的优质供应商，小米汽车销量的暴增也会为贵公司的业绩带来显著提升，并且随着四川新能源公司的成立，作为小股东非常看好贵公司今后在新能源汽车领域的发展前景，想请问贵公司今年在新能源汽车领域有哪些新的研发项目正在推进，诸如固态电池等领域，期待您在百忙之中能够给与回复，谢谢！！！
公司回答表示，尊敬的投资者，您好！公司暂未直接建立与小米汽车的合作关系，但会积极寻求相关合作机会。公司长期以来都是以技术为驱动，获得客户的广泛认可，在新能源汽车零部件的生产上提前布局，有一定的技术积累。近些年公司不断加大研发投入力度，开展了较多具备前瞻性的研发项目，屡屡获得发明专利，我司将进一步造好技术的护城河。感谢您的关注！
点击进入互动平台 查看更多回复信息
",0,0,7.5,https://xueqiu.com/k?q=宁德时代
300750,宁德时代,45385.63056, 牛老师策略,宁德时代：公司是锂电池概念龙头，是小米汽车su7的电池供应商，小米汽车概念在周一走强之后，周二迎来了分化，但是宁德时代周二还是比较抗跌的，从技术分析来看，现在这个位置的均线也是开始由空头趋势往多头趋势排列，这个位置向下的空间有限，中线上方还是有较大的反弹的空间，他和长安汽车都是中线的布局，要有耐心。,0,0,5.5,https://xueqiu.com/k?q=宁德时代
300750,宁德时代,45385.60625, 金主大大只想抄作业,2024年以来，中证A50指数成为市场新的炸子鸡！讲真，市场上的A50真多！中证A50、富时A50、MSCIA50，还有一个大家熟知的上证50（虽然不带A，但是知名度很高、产品多且规模大，姑且也算一个），加起来就有4个了，我们该怎么选呢？今天我们就来聊聊它们的区别！本文内容较长，将主要内容总结成如下图片供大家参考：一、编制方案区别首先来看一个表，比较详细地列举了4只50指数在编制方案上的区别。从编制方案看，中证A50更加侧重细分行业均衡和成长性，富时A50更侧重大市值的代表性，MSCI A50兼顾宽行业均衡和市值，上证50最独特的点在于全部是上交所股票，在A股代表性上就有些不如其他3大A50了。1、市值风格：富时A50更能代表大市值风格从成份股平均市值来看，富时A50成份股市值规模遥遥领先于其他3只指数，这也说明富时A50的大市值属性最强。2、行业均衡度：中证A50更全面均衡我们将四只50指数的成份股用申万一级行业进行分类，可以看出，中证A50覆盖了27个申万一级行业，上证50覆盖21个行业，MSCI A50覆盖20个行业，富时A50覆盖17个行业。另外，从行业集中度上看，在前3大、前5大、前10大行业上，中证A50的合计权重均小于其他三个50指数，为排名靠后的行业留下了充足的空间。从细分行业覆盖度、均衡度上来说，中证A50确实更胜一筹。二、指数的行业特征消费、金融、科技、新能源、医药是A股的重头戏，自然也是4只50指数的重头戏。但是，这种相同中也有不同。1、消费：从4只指数的消费板块权重占比来看，富时A50中消费占比最高，其中白酒权重占比近1/4，遥遥领先于其他指数，这是一只 “酒”味有点重的A50！而相对来说，中证A50含酒量最低，但它的可选消费（家用电器+汽车）占比最高。2、金融：从金融占比来看，富时A50又是碾压其他指数，尤其是银行，富时A50中银行占比超20%，含“银”量有点超标！中证A50在金融上占比是4只50中最低的。3、AI科技： 我们筛选出AI相关的科技行业（半导体+计算机+通信）的个股并进行权重汇总，可以看出，中证A50的AI科技含量最高，上证50紧随其后（半导体和通信含量最高）。当下AI科技自带热度，喜欢AI和相对高弹性的，一定不能错过中证A50。4、新能源：MSCI A50相对多一些。MSCIA50发布于2021年9月，当时刚好是新能源大年，MSCI A50一出生就自带高“能”，这是它区别于其他A50的最大亮点。5、医药：4只50指数相差不大，中证A50相对多一些。医药是A股热门赛道，在人口老龄化的背景下，长期投资价值可期。三、央国企含量PK低利率时代，高股息资产成为香饽饽。2023年以来，中特估、高股息、红利相继成为热门投资概念。从历史数据来看，上证50、富时A50的股息率要相对高一些。高股息的背后，是上证50和富时A50的央国企含量相对高一些。如果想要捕捉高股息、“中特估”行情，可以优先选择上证50和富时A50。四、A50基金盘点总之，4只50指数各有千秋，看你自己更喜欢哪个！ 最后，列举市场上常见的A50基金供大家参考：附：今日估值信号今日早盘，固态电池、钠离子电池等概念走强，目前，电池主题指数估值依旧很低。最近新能源车企公布了亮眼的销售数据，在下游销售强劲的影响下，电池主题指数或能迎来估值修复机会。不了解估值的小伙伴可以查看之前的文章：滴！信号灯亮了！用好这个工具，你也是投资高手不必四处看，我就是答案！ ,4,1,6,https://xueqiu.com/k?q=宁德时代
300750,宁德时代,45385.60556, 靠谱纪要库,从单价看；优秀的客户结构拉开宁德与同行业的差异。2023年公司动力出口+特斯拉+商用车客户占比在60%以上；储能基本都是出口。从19-21年数据看宁德动力单Wh售价比中航高0.1-0.25元左右，储能高0-0.14元左右，价格差异主要来自于产品结构优势：2、商用车在动力电池中占比较高；毛利率水平高于普通乘用车。商用车是最早推广动力电池的领域之一，宁德在该细分市场占据绝对主导地位，市占率约70-80%；根据高工锂电近三年国内动力电池装机数据，宁德动力电池装机量中接近20%为商用车客户。商用车对电池循环寿命要求极高，宁德的产品虽然单价略贵，但是寿命的优势使得单公里成本优于同行业，客户也愿意付出溢价。而且商用车电池循环问题要在使用多年后才能发现，宁德的长期口碑建立有利于继续保持优势。从产业链集中度角度来看，传统商用车主机厂集中度相对低-内燃机厂商集中度相对高的特点，这一点与电动商用车类似，主机厂商集中度相对较低-电池厂集中度高，我们认为商用车会延续这一产业链特点。3、2023年公司储能出口占比预计约70%（不含间接出口部分）；毛利率高于国内。海外市场对于循环寿命、电池品牌的要求极高，所以宁德的电池性价比明显更高，逻辑类似于商用车。从单位成本看；由于产品差异导致宁德优势不明显。根据19-21年公开数据，公司BOM成本比中航低（-0.06）-0.14元左右，制造费用和人工费用相近。我们认为主要原因是公司折旧年限短导致制造费用高；另外公司海外客户占比高，检测工作量大需要更多人工参与。宁德在单GWH设备投入、人员投入都有大幅下降，随着后续电池形态标准化程度更高，公司或引入10GWH级别的大线，大幅减少折旧和人工费用。 进一步的通胀逻辑；是争夺底盘定价权。在保持优秀客户结构的同时，宁德近年来不断推出麒麟电池、神行电池、大圆柱电池、CTC结构以及滑板底盘，一方面是在固化电池形态，有利于公司成本优势的进一步体现；另一方面则是在深度参与底盘设计乃至底盘定义。在售价端公司持续寻找通胀路径，在产业链地位上则是更加大胆的举动――交付电芯、交付pack、交付系统、最终交付底盘，我们预计是宁德时代要走的路。投资建议：我们预计公司2024-2026年实现归母净利459.93/554.70/643.69亿元，同比+4.2%/+20.6%/+16.0%，对应EPS为10.46/12.61/14.63元，维持“买入”评级。,0,1,5.5,https://xueqiu.com/k?q=宁德时代
300750,宁德时代,45385.59583, 卖了房子也要买股票,宁王还是宁虫,0,0,5,https://xueqiu.com/k?q=宁德时代
300750,宁德时代,45385.59514, 闷得而蜜,阳光电源和宁德时代都在新能源，一个是能源转换，一个事能源存储。虽然隔得比较远，但走势却惊人的相似。下图是2021年10月开始到现在的K线图，这两兄弟基本一步一趋跟着走。也可以理解：1、产品都还行，全球领先；2、市场格局全球领先；3、竞争激烈，小伙伴特别多；4、都受过去几年新能源大跃进所困，消化库存；5、都收到地缘因素的严重干扰。,16,5,5,https://xueqiu.com/k?q=宁德时代
300750,宁德时代,45385.59306, 陆家嘴赏月,今天贵金属、工业金属、小金属都暴涨，华友目前板块垫底，真是。倒车接人。,2,1,5,https://xueqiu.com/k?q=宁德时代
300750,宁德时代,45385.59306, 但饼,今天怎么啦？估值比宁德低，今年业绩增速也高于宁德，按说走势应该要比宁德强才对呀,0,0,4.5,https://xueqiu.com/k?q=宁德时代
300750,宁德时代,45385.58819, 没业绩的股不买,涨不过锂矿，是不是因为占比太大了？,0,0,5,https://xueqiu.com/k?q=宁德时代
300750,宁德时代,45385.58681, 半导体渣活该卡脖子,要跌就快点的。在这里做顶,1,0,5,https://xueqiu.com/k?q=宁德时代
300750,宁德时代,45385.58681, 富国基建君,电池中国联合动力电池应用分会梳理了2024年一季度，新能源汽车销量靠前的国内车企动力电池配套信息，以供参考(注：数据来自各车企披露的数据，未披露车企未纳入统计),1,0,5,https://xueqiu.com/k?q=宁德时代
300750,宁德时代,45385.58542, 韭菜天赋,200就是这一波的顶了吧,3,2,7.5,https://xueqiu.com/k?q=宁德时代
300750,宁德时代,45385.58472, 易方达红利,国内经济底部拐点已现，低斜率复苏确定性较高，经济高质量转型发展中，A股优质核心资产配置价值凸显。中证A50指数是典型的大盘风格指数，投资者可借助其构建大小盘风格轮动策略，精准表达自身的投资观点。且大盘风格估值处于历史低位，安全边际较高，向上修复空间较大。,4,0,6,https://xueqiu.com/k?q=宁德时代
300750,宁德时代,45385.58472, 炒股致富就是我梦想,想不通还有一帮***在高位接盘，从150涨到200了，哪有只涨不跌的股票，下周185 180抄不香吗？？？现在还买，摆明了接盘，目前庄家跑了4个亿了，聪明一点吧,3,8,3.5,https://xueqiu.com/k?q=宁德时代
300750,宁德时代,45385.58125, 招财猫ma,固态电池研发技术路线百花齐放，全球固态电池技术研发主要集中在欧、美、日、韩、中，感觉咱们最有优势！我就把拿稳。,1,0,6,https://xueqiu.com/k?q=宁德时代
300750,宁德时代,45385.57986, 科创100指数ETF,1831年到1834年，Michael Faraday发现了固体电解质硫化银和氟化铅，为固态离子学奠定了基础。1950年代后半期，多种电化学体系曾使用银离子固体电解质，但存在内阻高、能量密度低、电压低等主要问题。1990年代，橡树岭国家实验室开发的一类新型固态电解质，用于制造薄膜锂离子电池。直到2000年，各大汽车厂商和开发商开始对固态电池技术产生越来越大的兴趣。固态电池是一种使用固体电极和固体电解液的电池技术。与传统的液态锂电池不同，固态电池中不含液体，所有材料都以固态形式存在。具体来说，它由正极材料、负极材料和电解质组成，而液态锂电池则由正极材料、负极材料、电解液、隔膜组成。固态电池的电解质为固态，这种结构可以使更多带电离子聚集在一端，传导更大的电流，从而提升电池容量。因此，同样的电量，固态电池的体积将变得更小。但英国《金融时报》近日刊登了对宁德时代董事长曾的采访，他对车载固态电池商业化进程提出了质疑。他表示，电动汽车固态电池距离商业化还有数年时间，“很多因素”阻碍了其发展。其表示，他的研究小组目标并非固态电池，而是使用半固态材料的钠离子电池和凝聚态电池，其原型已在生产中，并声称这种半固态材料可存储的能量是传统锂离子电池的两倍。业内专家认为固态电池避免了目前技术中使用的液态电解质，可以实现更大的续航里程，从而改变电动汽车。丰田公司曾大肆宣扬其进展，并承诺最早将于 2027 年交付固态电池。上汽集团宣布，超级智能轿车智已L6将于4月8日正式亮相。究竟会成为行业的里程碑还是在喧嚣过后的一地鸡毛。重点布局医药生物、电子、新能源三大成长板块，并且对于计算机、机械设备、国防军工等板块布局良好。其中也包括文章中提到了电动车新势力九号公司！无论是从基本面上还是政策上来看，科创100指数的反转趋势都非常明显，后市表现也值得期待。 @今日话题 @指慧家 @雪球基金 免责声明：转载内容仅供读者参考，版权归原作者所有，内容为作者个人观点，不代表其任职机构立场及任何产品的投资策略。本文只提供参考并不构成任何投资及应用建议。如您认为本文对您的知识产权造成了侵害，请立即告知，我们将在第一时间处理。风险提示：任何在本文出现的信息（包括但不限于评论、预测、图表、指标、理论、任何形式的表述等）均只作为参考，投资人须对任何自主决定的投资行为负责。另外，本文中观点、分析及预测不构成对阅读者任何形式的投资建议，本公司亦不对因使用本文内容所引发的直接或间接损失负任何责任。基金投资有风险，基金的过往业绩并不代表其来表现，投资需谨慎。,1,0,5,https://xueqiu.com/k?q=宁德时代
300750,宁德时代,45385.575, 一起养猪-,致敬中国的优秀企业！关键是逃跑的商人居然说为小米汽车感到担忧？也是，毕竟乐视和法拉第早已经瓦塔西了，没什么好担忧的了。没事来蹭蹭热度，帮别人担忧一下也实属正常！,2,0,7,https://xueqiu.com/k?q=宁德时代
300750,宁德时代,45385.57222, Fuffet,腾势N7上市当晚订单3378台，选630Max的比例最高，高阶智驾选择比例接近40%，上市表现不错啊，全新N7要雄起,5,2,9,https://xueqiu.com/k?q=宁德时代
300750,宁德时代,45385.56944, 界面有连云,截至2024年4月3日 13:32，新能车ETF(515700.SH)早盘一度涨近1%，午后震荡调整，最新报价1.53元，盘中成交额已达7284.08万元，换手率2%。跟踪指数成分股方面涨跌互现，瑞泰新材(301238)领涨14.61%，利元亨(688499)上涨7.71%，赢合科技(300457)上涨6.99%。拉长时间看，截至2024年4月2日，新能车ETF近1周累计上涨2.96%，涨幅排名可比基金1/2。规模方面，新能车ETF近1周规模增长2.21亿元，实现显著增长，新增规模位居可比基金1/2。数据显示，杠杆资金持续布局中。新能车ETF最新融资买入额达599.38万元，最新融资余额达9241.49万元。消息面上，今日，小米汽车SU7开始交付了。4月3日上午，小米SU7首批交付仪式在北京亦庄的小米汽车工厂总装车间举行。小米集团创始人、董事长兼CEO雷军出席仪式，亲手向首批车主交车，全国28城交付中心也同步开启首批交付。雷军在交付仪式上表示，小米SU7开售短短几天时间，就有了超过10万人大定，锁单量已经超过 4万单。业内机构预计预计SU7将成为中国销量前三的高端轿车型号之一，平均每月销量超过1万辆，平均零售价格为25万元人民币。该机构还预计，小米汽车将在2028年实现盈利。华泰证券研报认为，小米发布SU7，定价具有性价比，订单火热。定价符合此前20万-30万预期，考虑到续航在700KM-830KM，定价具性价比，也为后续产能爬升及激烈竞争下推出更低续航版留出可能；此次虽然发布价格没有低于20万，但从电池包配置、动力、内饰、智能化上看依旧具备较强竞争力。后续不排除随着产能爬坡或者市场竞争加剧情况下，存在提供更低续航版本的可能性。新能车ETF(515700.SH)紧密跟踪中证新能源汽车产业指数，中证新能源汽车产业指数从沪深市场中选取业务涉及新能源汽车产业的上市公司证券作为指数样本，以反映新能源汽车产业上市公司证券的整体表现。数据显示，截至2024年3月29日，中证新能源汽车产业指数(930997)前十大权重股分别为宁德时代(300750)、比亚迪(002594)、汇川技术(300124)、三花智控(002050)、天齐锂业(002466)、亿纬锂能(300014)、赣锋锂业(002460)、华友钴业(603799)、格林美(002340)、先导智能(300450)，前十大权重股合计占比55.38%。新能车ETF(515700)，场外联接(A类：012698；C类：012699)。 以上内容与数据，与界面有连云频道立场无关，不构成投资建议。据此操作，风险自担。 @雪球基金 @今日话题 @雪球创作者中心,0,0,5.5,https://xueqiu.com/k?q=宁德时代
300750,宁德时代,45385.56806, 长线可以钓大鱼,昨日电池获主力资金净流入7.24亿，今日市场持续震荡调整，在四连阳后也开始回调，截至发稿跌1.25%。近日，上汽集团公开披露了与清陶能源在固态电池技术研发及产业化方面的重大突破。双方共同研发的第一代固态电池产品已经开始进入实质性的排产阶段，此举标志着我国在固态电池这一尖端新能源汽车电池技术领域迈出了实质性的一步。固态电池因其卓越的安全性、高能量密度和更快的充电速度，被视为下一代电动汽车电池的理想选择。随着规模、技术、市场及产业链不断成熟，固态电池整体出货量将呈现快速增长趋势。依据EVTank对于全球锂离子电池出货量的预测，2025年、2030年全球固态电池出货量分别突破43GWh、570GWh，复合增长率为67.68%，预计2030年全球固态电池整体渗透率约为9.4%。  智己汽车官宣行业首个准900V超快充固态电池即将量产上车。也预示着固态电池技术的商业化进程加速推进，布局固态电池产业链的公司，有望在固态电池大规模商业化的过程中分得一杯羹，进一步推动我国新能源汽车产业链的整体升级和发展。不想错过固态电池投资机会的可以关注一下电池ETF（SH561910），该ETF紧密跟踪中证电池主题指数，主要投资于电池产业链上的优质企业，包括电池制造商、材料供应商等。随着新能源汽车渗透率提高，电池板块或将迎来较大的估值修复弹性，长期布局效益更佳。   ,0,0,6.5,https://xueqiu.com/k?q=宁德时代
300750,宁德时代,45385.56667, Fuffet, 卡塔尔｜3月31日，多款纯电及混动车型上市！中国驻卡塔尔大使馆曹小林大使出席！,1,0,6.5,https://xueqiu.com/k?q=宁德时代
300750,宁德时代,45385.56111, Fuffet, 荣耀出击秦家族3月热销40569辆环比增长150.6%累计销量超141万辆,0,0,6,https://xueqiu.com/k?q=宁德时代
300750,宁德时代,45385.56042, 探索学习者,即便拉了一个涨停，我也没太有感觉主力拉升强势。反弹有可能，反转冲锋不像。控制好资金，还是按计划定投。这取决于各位给的好价格。毕竟还想在二十多多拿些筹码。天齐也是五十左右多好啊！最起码4月末才出数据。还有这么长时间，长期定投或者短打都可以。还是感觉今年大盘弱。当然了，除了新能源公司所有行业我都不看好，包括白酒，医药。感觉这两天华友只不过是量化收集筹码罢了。量化这玩意，割韭菜的行家。所以今年就不要赌身家在股市。今年的新店很不错。如果效益好，下半年的新饭店可以直接安排了。资金多用在现金流增长上，股市好不好，都可以游刃有余。不管谁怎么吹，怎么分析，作为投资者要保持本心和节奏。当然，我更希望这几个票子多压些日子，让我多吃一点筹码。目前除了这三个票子，基本上这次反弹的其它票子都卖光了。后续资金鼓鼓的。这些天得多出去考察新项目。时代多好，该疯狂的九五后一代毫无进取之心，空间还是我们这代人的。哈哈哈哈等这一波人过了三十五，幡然悔悟时，我家孩子就可以稳稳滴坐在制高点上。稳坐钓鱼台。认知决定命运。时代对我们很友善。多拼搏进取才是王道。各位做多的兄弟温柔点，多给我点时间。不多说，下午还有个客户谈。,7,0,5.5,https://xueqiu.com/k?q=宁德时代
