Stock Code,Company,Update time,Author,Texts,Likes,Comments,情绪得分,URL
TSLA,特斯拉,2024/4/4 23:58, 百岁1981,该交的筹码都交出了，机构开始发力了,11,1,8,https://xueqiu.com/S/TSLA
TSLA,特斯拉,2024/4/4 23:58, 高雅的回报侠客,为什么这个股可以直线上涨？我晕…..空了1万美金，现在亏损严重。,2,3,3,https://xueqiu.com/S/TSLA
TSLA,特斯拉,2024/4/4 23:57, 输九牛赢一毛,为什么突然暴涨？,0,0,1,https://xueqiu.com/S/TSLA
TSLA,特斯拉,2024/4/4 23:56, 悲哀的小散,都好好的看一下，特斯拉当下所谓的自动驾驶，还需要监督前路，搞个所谓自动驾驶，还要监督前路，这比自己开车还累，这样的自动驾驶有何意义，哪个傻叉会持久订购,0,9,1,https://xueqiu.com/S/TSLA
TSLA,特斯拉,2024/4/4 23:56, 郁闷的鞋套-,一柱擎天！！！！！,0,0,8,https://xueqiu.com/S/TSLA
TSLA,特斯拉,2024/4/4 23:55, 输九牛赢一毛,都是哪些大聪明在买啊？,0,0,5,https://xueqiu.com/S/TSLA
TSLA,特斯拉,2024/4/4 23:51, 深刻的股指小勇士,空军别怕 上涨是为了更好的下跌 你们不是等着季报会爆大雷呢？,0,0,3,https://xueqiu.com/S/TSLA
TSLA,特斯拉,2024/4/4 23:51, 寂小桦,咋回事，正式开始逼空？,0,0,5,https://xueqiu.com/S/TSLA
TSLA,特斯拉,2024/4/4 23:50, 输九牛赢一毛,昨天刚做空就连两天暴涨，真是服了,6,0,4.5,https://xueqiu.com/S/TSLA
TSLA,特斯拉,2024/4/4 23:41, 柯基丶,利空出尽的走势 提前赌财报？,0,1,5,https://xueqiu.com/S/TSLA
TSLA,特斯拉,2024/4/4 23:41, 悲哀的小散,在手机赛道，谁敢把价格卖过苹果啊，但汽车赛道则完全不同，中国这些电车卖的又贵又好，汽车这行没有护城河，拿特斯拉与苹果比，巴菲特笑你傻叉,0,1,5,https://xueqiu.com/S/TSLA
TSLA,特斯拉,2024/4/4 23:38, 炒股见人性_慢慢来,特斯拉先涨为敬，周一迪王、宁王打压打压小特的气势。,0,0,5,https://xueqiu.com/S/TSLA
TSLA,特斯拉,2024/4/4 23:29, 上海炒家方军打板,方军，参与特斯拉。加仓1成。,3,2,6,https://xueqiu.com/S/TSLA
TSLA,特斯拉,2024/4/4 23:17, 悲哀的小散,木头姐尽扯蛋，几乎除了中国，很难有政府可以大力推动电动汽车的发展，未来电车的发展要靠电池的进步，但这不知道要多久，至于无人驾驶，更不知道要多久，真来了，受益的也是优步滴滴，对特斯拉只是利空。现在的自动驾驶就是个玩具，只有体验性，没有实用性，几个人会持久的花钱去买个玩具,1,25,2.5,https://xueqiu.com/S/TSLA
TSLA,特斯拉,2024/4/4 23:15, 沙漠苍狼的投资家园,今年很惨，但继续加仓。半仓,2,0,5,https://xueqiu.com/S/TSLA
TSLA,特斯拉,2024/4/4 23:13, 哥哥带你超,突然想明白了，ios没有替代品，fsd也没有，目前看来是这样的,0,1,3,https://xueqiu.com/S/TSLA
TSLA,特斯拉,2024/4/4 23:12, SoldaatX,今天差不多同样的价格，买哪个好呢？,1,0,5,https://xueqiu.com/S/TSLA
TSLA,特斯拉,2024/4/4 23:11, 深刻的股指小勇士,如果丰田的混动搭配特斯拉的自动驾驶 会不会是汽车的最终答案,0,2,5.5,https://xueqiu.com/S/TSLA
TSLA,特斯拉,2024/4/4 23:10, Loong01,自带光环的两巨头，今年暂时跑输指数，股价惊人的一致。年底再来看吧～,1,0,7.5,https://xueqiu.com/S/TSLA
TSLA,特斯拉,2024/4/4 23:04, 悲哀的小散,这个票就是一群傻比在做梦,1,8,1.5,https://xueqiu.com/S/TSLA
TSLA,特斯拉,2024/4/4 23:00, 金融界网站,4月4日，特斯拉(TSLA)盘中上涨1.23%，截至22:29，报170.45美元/股，成交34.54亿美元。财务数据显示，截至2023年12月31日，特斯拉收入总额967.73亿美元，同比增长18.8%；归母净利润149.97亿美元，同比增长19.44%。大事提醒：4月3日，特斯拉获德意志银行下调目标价至189美元，最新评级Buy。4月23日，特斯拉将于(美东)盘后披露2024财年一季报。,0,0,5.5,https://xueqiu.com/S/TSLA
TSLA,特斯拉,2024/4/4 22:59, 祈福在春天,“木头姐”预测，未来五年内全球范围75%到85%的新车销售额将是电动汽车所贡献。,0,0,6,https://xueqiu.com/S/TSLA
TSLA,特斯拉,2024/4/4 22:55, 人生万般皆是命,加大力度做空,0,0,5,https://xueqiu.com/S/TSLA
TSLA,特斯拉,2024/4/4 22:51, 悲哀的小散,真无人驾驶了，出租车一样有私密空间，还有几个人去买车，去交保险，搞维护等等，最终受益的只能是滴滴优步们，自动驾驶公司太多了，它们相对于平台公司没有议价能力,0,0,2.5,https://xueqiu.com/S/TSLA
TSLA,特斯拉,2024/4/4 22:42, 红猪199x,再来个10%，这个月翻倍了,0,0,4,https://xueqiu.com/S/TSLA
TSLA,特斯拉,2024/4/4 22:38, 寻找神话,虽然没有开过特斯拉，但就是相信特斯拉,5,1,7,https://xueqiu.com/S/TSLA
TSLA,特斯拉,2024/4/4 22:32, 精华芭比娃娃,慢慢涨上去了,0,0,5,https://xueqiu.com/S/TSLA
TSLA,特斯拉,2024/4/4 22:17, 穿越牛熊风波里,今晚还可以哦,0,0,8,https://xueqiu.com/S/TSLA
TSLA,特斯拉,2024/4/4 22:01, 钱塘漫步,@钱塘漫步 看来老马确实把比亚迪作为新能源车的标杆啊,1,0,7,https://xueqiu.com/S/TSLA
TSLA,特斯拉,2024/4/4 21:49, 果业,现在彻底成弃婴了，远景虽诱人，但短期看是没啥可操作性的，远离它吧，没必要对某一个股票上头，即使创始人如何优秀，描述的未来多么厉害，目标100.,0,0,4.5,https://xueqiu.com/S/TSLA
TSLA,特斯拉,2024/4/4 21:37, 吴颜祖,吃屎啦你,0,0,4.5,https://xueqiu.com/S/TSLA
TSLA,特斯拉,2024/4/4 21:36, 好吃的吃,马斯克昨天说了，准备把FSD对外开放，授权给其他车企使用，这简直是放大招，再加上国内准备开放FSD，未来智驾应该是每一辆车的标配，后续没有智能驾驶应该是消费者首先考量的条件了，看好智能驾驶硬件板块。,2,0,5,https://xueqiu.com/S/TSLA
TSLA,特斯拉,2024/4/4 21:24, 卡卡罗特Goku,周四周五准备把前天跌的涨回去？,0,1,5,https://xueqiu.com/S/TSLA
TSLA,特斯拉,2024/4/4 20:54, 肥_牛,各大佬造车结果：董明珠：我来造车，你们靠边站，格力掌握核心科技！结果花了800亿，耗时9年，无终而果；贾跃亭：敢于担当，勇于创新，十年造车一场空，用500亿耗时9年，流离失所；许家印：我们恒大有钱，不差钱，花1000亿，造车3年，总吹牛逼，恒大负债万亿，自己进去；库克：做手机行，做汽车，花100亿美元，10年，果断放弃；雷军：雷军造车，天命所归，雷（）字带电，军字带车，仅仅花费100亿，用时3年，堪比奇迹！就造车说做就做这一点，你说谁牛！,1,0,4,https://xueqiu.com/S/TSLA
TSLA,特斯拉,2024/4/4 20:51, 林克闲谈,特斯拉中国今日宣布，针对Model 3/Y车型上线限时低息置换政策，并首次推出“0利息”分期购车的优惠政策。 据悉，4月底前下订最新款的Model 3/Y车型，最长可享3年0息或5年超低息。以3年36期免息举例，只需7.99万元首付，便可开走一台Model Y，日供至多171元。 我每天都是会收集国内外最新的消息，可能影响我们当天或者第二天股市的，如果觉得对您有用，记得点赞+关注！！！更多更详细解读请移步  林克闲谈（lincxt）,1,0,5.5,https://xueqiu.com/S/TSLA
TSLA,特斯拉,2024/4/4 20:43, 肥_牛,特斯拉推出0利息金融政策免利息实际上就是车企补贴给银行，modely这种，如果最低首付五年免息，得补贴给银行三万块吧。特斯拉实际上这波不仅没有涨价，反而是加大了优惠力度。特斯拉这动作我觉得就是被小米逼的，小米一周收获超过四万真实大定，这是抢的谁的单？不是蔚来，蔚来轿车交付量很低了，也不是小鹏p7i，月交付量更低。更不是极氪，极氪最近一周迎来历史性的订单暴涨，其他车企我看也没有。唯一可能，抢的是特斯拉的单，而且抢的非常凶。中国新能源车企已经做出了很多款性价比超过特斯拉的车型，比亚迪ev的销量曾超过特斯拉，但是从没有车企能从特斯拉手里抢到订单，说白了就是分享纯电市场扩大，但并没撼动特斯拉的地位，并未形成此消彼长。我认为小米汽车是第一次有机会撼动特斯拉的地位，并且能和特斯拉model3形成此消彼长的形势。我做个预判吧，四月份model3销量会有明显体现，被小米汽车超越只是产能问题，大概率本月或下个月就可能被超越。modely也会受影响。等着看。,1,9,5,https://xueqiu.com/S/TSLA
TSLA,特斯拉,2024/4/4 19:57, 茶人易茗,之前我开过特斯拉毛豆三，驾驶体验还是不错。今天从一个副驾乘坐者的角度，又体验了一把，说几点感受和发现：①毛豆三前后空间还是不错，后备箱空间也OK ②底盘有点硬，乘坐舒适感不行 ③车内饰比较简洁简单，风格对于我来说不是问题，但窗上扶手也去掉了，有点不适应 ④百度导航一直是特斯拉的短板，不好用，且第二年开始还得付费使用，司机索性使用手机导航更方便 ⑤今天再看特斯拉毛豆三，确实不香了，23-26万价格区间B级纯电轿车有太多选择，比如小鹏P7i，整体软硬件秒杀毛豆三。,3,0,6,https://xueqiu.com/S/TSLA
TSLA,特斯拉,2024/4/4 19:57, 星星海心,马斯克在X上发帖回应特斯拉投资者罗伯特.格伯对该公司一季度销量下滑的批评，并将中国竞争对手比亚迪的销量拿来作对比。格伯对特斯拉第一季度惨淡的业绩进行了猛烈抨击，并认为马斯克应为此负全部责任，是他的“有害行为”导致特斯拉的车卖不出去。他还发帖呼吁特斯拉改组董事会，“应该立即由独立董事取代。”马斯克回应称：“他真是个白痴，连自己是个白痴都不知道。比亚迪的销量较上季度下降了42%。这对每个人来说都是一个困难的季度。”,5,6,3.5,https://xueqiu.com/S/TSLA
TSLA,特斯拉,2024/4/4 19:56, 深刻的股指小勇士,今天看到小米门店排着长龙 相比下其他车企门店冷冷清清 营销也是企业的核心竞争力,0,0,6,https://xueqiu.com/S/TSLA
TSLA,特斯拉,2024/4/4 19:49, 第四次产业革命,"。。。去除机械传动轴是电动汽车技术发展的一个重要里程碑，它不仅提升了电动汽车的性能和效率，也为汽车设计和制造带来了新的机遇和挑战，推动了整个行业向着更加可持续和环保的方向发展。随着电动汽车技术的不断进步，我们可以期待未来汽车将更加高效、智能和环保。这一变革带来了多方面的优势：提高能效：电动汽车通过电机和电池直接提供动力，省去了传统内燃机车辆中动力从发动机到车轮的多级传递过程，减少了能量转换和传递过程中的损失，提高了能源利用效率。增加空间利用率：没有传动轴和差速器等机械部件，车辆底盘的设计可以更加紧凑和灵活，为电池组的布置提供了更多空间，同时也为乘客和行李提供了更宽敞的内部空间。减轻重量：电动汽车的电机和电池组通常比内燃机和传动系统轻，去除传动轴进一步降低了车辆的重量，有助于提升车辆的加速性能和减少能量消耗。降低维护成本：电动汽车的动力系统相对简单，部件较少，磨损和故障的可能性也较低，从而降低了车辆的维护成本和运营成本。设计灵活性：没有传动轴的限制，汽车设计师和工程师可以更加自由地设计车辆的内部和外部结构，创造出更加多样化和个性化的车型。推动电动汽车技术的发展：电动汽车的无传动轴设计简化了动力系统的结构，使得电动汽车在动力传输上更加高效和直接，同时也为电动汽车的性能提升和技术创新提供了更多可能性。前驱、后驱和四驱 和 电四驱一、前驱、后驱和四驱是汽车行业中描述车辆动力传输方式的术语，它们各自有不同的特点和适用场景：前驱（Front-Wheel Drive, FWD）：动力传输：发动机的动力直接传递给前轮，由前轮负责推动车辆前进。优点：结构简单，空间利用效率高，通常能提供更好的燃油经济性，车辆重量分布较前，有利于提高高速稳定性。缺点：在高速行驶或急加速时容易出现转向不足（推头现象），爬坡能力相对较弱，尤其是在湿滑路面上。后驱（Rear-Wheel Drive, RWD）：动力传输：发动机的动力通过传动轴传递给后轮，由后轮负责推动车辆前进。优点：提供更好的操控性和平衡，车辆重量分布较均匀，加速性能和爬坡能力较强，适合高性能和豪华车型。缺点：结构相对复杂，空间利用效率较低，可能导致燃油经济性不如前驱车型，且在湿滑路面上可能更容易打滑。四驱（Four-Wheel Drive, 4WD）/全轮驱动（All-Wheel Drive, AWD）：动力传输：发动机的动力同时传递给前后轮，使得四个轮子都能获得动力，提高车辆的牵引力和稳定性。优点：在各种路况下都有良好的抓地力和稳定性，特别适合越野、雪地和湿滑路面，提高行车安全性。缺点：系统复杂，重量较重，可能导致燃油经济性降低，维护成本也可能较高。四驱系统又可以分为全时四驱（Full-Time 4WD）和适时四驱（Part-Time 4WD）：全时四驱：动力始终分配给四个轮子，无论路况如何。适时四驱：根据路况需要，系统自动或手动切换动力分配给前后轮。 二、电四驱的简要介绍：电四驱 (Electric Four-Wheel Drive, E-4WD):动力传输：在电动汽车中，电四驱通常意味着车辆有四个独立的电机，每个电机驱动一个轮子，或者有两个电机，分别驱动前后轴。这种方式不需要传统的传动轴和差速器，因为电力可以直接、独立地传输到每个轮子。优点：响应速度快：由于电力传输的即时性，电四驱可以更快地响应驾驶者的指令，提供更快的加速和更敏捷的操控。独立控制：每个轮子都可以独立控制，这使得在复杂路况下，如雪地、沙地或泥泞路面，车辆可以获得更好的牵引力和稳定性。结构性优势：由于没有传动轴和复杂的差速器系统，车内空间可以得到更有效的利用，同时也减少了机械损耗和维护需求。能量回收：在制动或下坡时，电机可以作为发电机使用，将动能转化为电能并储存起来，从而提高能效。缺点：成本：多个电机和电池组可能会增加车辆的成本。重量：虽然省去了传动轴和差速器，但多个电机和电池也可能增加车辆的总重量。维护：虽然机械部分减少了，但电气系统的复杂性可能带来新的维护挑战。取长补短：电四驱结合了传统四驱的稳定性和前驱、后驱的某些优点。通过先进的控制系统，电四驱可以在需要时提供强大的牵引力，同时在正常行驶时保持高效能耗。此外，随着电池和电机技术的不断进步，电四驱的续航里程和性能也在不断提高。总的来说，电四驱为现代电动汽车提供了一个高效、响应迅速且稳定的驱动方案，特别是在复杂或恶劣的路况下。",4,1,6.5,https://xueqiu.com/S/TSLA
TSLA,特斯拉,2024/4/4 19:22, 输九牛赢一毛,要起飞了……有什么利好吗？,0,0,4.5,https://xueqiu.com/S/TSLA
TSLA,特斯拉,2024/4/4 19:21, 巴甫洛夫,1，销量下滑。visualcapital的图能很好地解释问题。2023年1月，特斯拉全球大幅降价。在美国，高性能版Model 3降价14%至53990美元，Model Y长续航版降幅近20%，价格为52990美元。欧洲中国也都大降价，当时的新闻见链接网页链接降价促销后去年的基数有点高，本季度销量下滑8.5%也不是不能理解。成长股也不是每个季度都成长的。拿茅台来举例，2018年三季度茅台收入同比+3.2%，利润+2.7%，增速大降。财报出来之后茅台跌停。实际上，对于增速的回落，贵州茅台在三季度报告中表示，主要系上年同期茅台酒放量导致基数较高影响所致。2017年第三季度，茅台的酒价曾经经历过一轮暴涨，突破2000元的价格。为了应对茅台价格的大幅度走高，茅台在原本的产量基础上向市场放量6200吨以控价。也是高基数的问题。看当时的新闻报道。网页链接实际上茅台18年利润增长30%，此后继续增长到现在。2，车型老旧的问题，去年就说卖不动了，可销量不还是同比增长，排名名列前茅吗？从商业上来说，一辆车卖10年是稀缺能力，10年卖10辆车破坏价值。3，马斯克个人问题，“比亚迪环比跌更多，白痴”这就更不是问题了。之前骂泰国救援队是恋童癖；接受采访时抽大m（新出的马斯克传里说，SpaceX是NASA的承包商，所以马斯克不得不在几年内接受随机药物测试，还好我真的没兴趣碰毒品）；说要私有化特斯拉引发SEC诉讼；收购表弟太阳能公司是关联交易，定价是否公允；推特分心――之前的space x，脑机接口公司，挖洞公司，泡妞（还与谷歌创始人妻子有绯闻），打游戏哪个不分心。（芒格说他智商200，以为自己无所不能）马斯克之前也是这个性格，20年股价涨了就不是问题，现在跌了就成问题了？@今日话题,1,2,4,https://xueqiu.com/S/TSLA
TSLA,特斯拉,2024/4/4 19:07, 来电和断电,马斯克回应一季度销量大跌：比亚迪比我们还惨！,2,1,1.5,https://xueqiu.com/S/TSLA
TSLA,特斯拉,2024/4/4 19:00, 炒股即修行,比船夫哥还彻底的革命家！而且是比船夫哥晚了一年后的大声呼唤再牛逼的智能驾驶，也只是l2++，马克龙你这辈子大概率看不到自己公司的车，无驾驶员就能满大街拉客跑出租，你的估值该当如何呢？估值回到20倍吧？也才10倍PE吧,2,0,3.5,https://xueqiu.com/S/TSLA
TSLA,特斯拉,2024/4/4 17:56, 狠人顾沁禾,买进持有待风起，涨势不止浪升腾，特斯拉再度决战股价之巅！AI二年，好消息，年内特斯拉股价的颓势已经出现了很明显反转的迹象，伴随着英伟达和超微电脑的回撤，特斯拉逐渐登上了炫彩夺目的舞台，将再次绽放2020年的风采！现在需要做的很简单，就一个字，买，除了买还是买，没有其他那么多事，买进持有待风起就行了。PS：时机不等人，该上车时别犹豫，犹豫只会败北！仓位打满，融资撑起，买买买！  ,1,3,5,https://xueqiu.com/S/TSLA
TSLA,特斯拉,2024/4/4 17:53, michael_wu,"100左右的价格买入TSLA。2。虽然TSLA的优势降低了，股价不会像木头姐预期的那样，3年内涨到$2,000。 但涨回200、300是大概率事件。",2,3,5,https://xueqiu.com/S/TSLA
TSLA,特斯拉,2024/4/4 16:25, 莉莉安78,市场有点过于关注短期数据了,10,8,2.5,https://xueqiu.com/S/TSLA
TSLA,特斯拉,2024/4/4 15:46, wangdizhe,wangdizhe（北仪小孩）面对经济低迷，国家在想办法刺激经济，主要是6步。。。第一，想办法稳住房地产。。第二，发行特别国债，加速调结构，并化解地方债。。。第三，新三样尽量扛住出口（新能源汽车，锂电，光伏）。。第四、加大货币及财政刺激，择机降息。。第五、托底股市，慢慢恢复融资功能，提升财产性收益。。第六，保持人民币汇率不大幅贬值，以尽量留住外资。。房地产占到中国经济的30%，而且带动性很强，所以要关注楼市，因为只要楼市走弱，那经济就不会强劲复苏，这个和ppi同比，社融结构，m1边际变化，以及社零趋势结合来看，基本能对中国经济走势有个大概了解。。。从万科2023年报来看，现金流趋紧，而且2024和2025年面临的挑战最大。房子不好卖的，回款慢，债务逐渐到期，所以账面虽然900多亿现金，但已不能覆盖现有债务。。通过观望“万科自救”的过程，可以更好的感知“楼市变化趋势”，所以我买了一点万科，很少，纯游戏仓位，为的是“见点响，上点心”，这样可以更好观察“宏观周期变化节奏”。万科如果over了，那必然会恐慌，方便我抄底。。万科如果活过来了，那说明了楼市企稳，经济复苏提速，“业绩验证”阶段容易拉起来。。。所以它“生死随意”，我并不关心，学会利用就是了。。另外，以后买车的话要0首付了，说明高层想通过汽车消费来拉动经济，汽车在消费总量中占10%的当量，是除了房子之外，第二大权重单品。。。但另一方面也说明“车市越发内卷”，比亚迪打响年内价格战第一枪，然后小米su7就出来抢镜了。。后面还会有打价格战的。。一个行业只要进入“价格肉搏阶段”，那么毛利下降之后，肯定roe走弱。。。所以要警惕价格的内卷。。。尤其是行业渗透率达到一定程度之后，会越发惨烈，因为增量降低，为了生存，必然拼存量。。。所以我对于小米股票“敬而远之”，何况20pe也不便宜。。。有色之类的，我躲的更远。。。这些“强周期品种”，只有ppi回归零轴我才考虑。。别人爱挣多少都随意，不眼红。。。白酒之类的，我也比较谨慎。。茅台业绩中规中矩，29倍pe没啥安全边际。。。。生意不错，但价格没到目标，只能“敬而远之”。。。近1年，持股涨的最好的就是老凤祥b，和谭木匠。。。老凤祥b主要是金价走高带起来的。。。谭木匠这种小生意，以前没啥人关注，现在可能经济走弱，高股息吃香，也被拉起来了。。。弄的我没法补仓了。。。大秦铁路，和交通银行，都是低点位买的，对于我的持股成本而言，股息率都在8%以上，所以慢慢吃息，不着急。。。。护盘资金的存在，导致跌的不够狠（主要指的价值股），使得我的“左侧抄底”策略，受到一定抑制。。。。如果没有护盘的，那么靠着仓控技术，以及心理优势，可以发挥的更加淋漓尽致。。。但即便如此在沪指2700-2900点，也进行了“规模性点射”，主要猎杀成长股（比如之前说那4个行业etf）对于当下而言，没有太好的价格，也没有太大的情绪波动，业绩也一般，宏观延续走弱趋势。。。所以处于“心不乱，价不低，绩不良，势不举”的阶段。。。这个时候我“一动不动”。。。价格场和情绪场，天性就爱波动，因为不波动的价格，就是“管制”，而不波动的情绪，就是“伪装”。。所以只需静待即可，配合一些业绩分析，大致估算一下“估值性价比”，如果有机会再下手。。@今日话题 @雪球创作者中心 ,23,10,5,https://xueqiu.com/S/TSLA
TSLA,特斯拉,2024/4/4 15:42, 浪味仙乐享,特斯拉fsd已经测试了9亿英里，离正式发布很近了。,5,1,7,https://xueqiu.com/S/TSLA
TSLA,特斯拉,2024/4/4 15:36, 我爱说实话x,目前来看，以后生产的车都会搭载自动驾驶硬件配置。以华为赋能授权逻辑来看。特斯拉授权自动驾驶方案的硬件成本要低很多很多。这在新能源车价格那么卷的情况下有相当优势。那么全球众多车企都会走激光雷达的路子还是纯视觉端到端勒？,2,1,5,https://xueqiu.com/S/TSLA
TSLA,特斯拉,2024/4/4 15:00, 江南一页,看了几个油管上12.3的测试，评价还是很不错的,1,0,9.5,https://xueqiu.com/S/TSLA
TSLA,特斯拉,2024/4/4 14:47, 潇潇萧先生,特斯拉股票（纳斯达克股票代码：TSLA）价格已经飙升了很长时间。2020年，其股价上涨了695%，使埃隆・马斯克成为全球首富；2021年，谟衷黾恿50%，包括纳斯达克和标准普尔500指数在内美国主要指数都开始追踪特斯拉汽车股票价格。虽然目前特斯拉已经确立了自己作为电动汽车市场领导者地位，但随着许多品牌加入电动车市场，特斯拉未发展将面临挑战，未几年Tesla股价系否仍然会保持快速增长还有待观察。,0,0,5.5,https://xueqiu.com/S/TSLA
TSLA,特斯拉,2024/4/4 14:26, 阿门多拉,"下面是马斯克2017年的一段话，当时他就看到了纯视觉方案相对于激光雷达的优势。当时他就认识到这将是一条艰难的路，但确实有眼光，目前来看走对了，特斯拉FSD正在进入收获期。""I think it's pretty obvious that the road system is geared towards passive optical. We have to solve passive optical image recognition, extremely well in order to be able to drive in any given environment and the changing environment. We must solve passive optical image recognition. We must solve it extremely well.At the point at which you have solved it extremely well, what is the point in having active optical, meaning lidar, which does not C which cannot read signs; it's just giving you C in my view, it is a crutch that will drive companies to a local maximum that they will find very difficult to get out of.If you take the hard path of a sophisticated neural net that's capable of advanced image recognition, then I think you achieve the goal maximum.""",6,11,5.5,https://xueqiu.com/S/TSLA
TSLA,特斯拉,2024/4/4 14:24, 温哥华特斯拉小王子,哪里来的马甲 真缺德,0,0,5,https://xueqiu.com/S/TSLA
TSLA,特斯拉,2024/4/4 13:58, 脏羊炒股,买入状态,0,1,5,https://xueqiu.com/S/TSLA
