Stock Code,Company,Update time,Author,Texts,Likes,Comments,情绪得分,URL
NIO,蔚来,2024/4/4 21:04, Harryz9b,蔡崇信：阿里过去几年忘记了真正的客户是谁淘宝是靠着无数的小卖家发家的，不过后来为了转型，把流量基本上全部给了大卖家，尤其是天猫。最后小卖家基本上都去了拼多多，顺便也把客户都带到了拼多多。也成就了拼多多的奇迹逆袭。其实小米也是一样，小米汽车发布的SU7，明显是想学特斯拉，从高端开始，慢慢下沉到中低端，这样做没有问题，但是小米也不要忘记自己的客户是谁，小米以后走量的汽车一定是10万左右的汽车，普通老百姓的需要才是小米汽车应该关注的重点。所以第三款汽车，我是真的觉得小米真要做10万左右的车。第二款可以做15万到25万的SUV，不要以为做低端就不赚钱，毕竟世界前五的汽车商，没有奔驰宝马奥迪保时捷，反而是大众本田丰田。小米汽车的目标是世界前五，最后还是要靠中低端汽车。个人看法，望轻喷，没有教雷总做事的意思。,13,8,5,https://xueqiu.com/S/NIO
NIO,蔚来,2024/4/4 20:05, 蔚来(NIO),来源：雪球App，作者： 蔚来(NIO)，（https://xueqiu.com/-1/284830010）SC 13G/A [Amend] Statement of acquisition of beneficial ownership by individuals Accession Number: 0001088875-24-000065 ?Act: 34 ?Size:?11 KB 网页链接,0,0,5,https://xueqiu.com/S/NIO
NIO,蔚来,2024/4/4 18:08, 尺度财经,文丨沛奇4月1日，国内多家车企宣布推出优惠举措，尽管当天是愚人节，但车企们一点都没有开玩笑。蔚来拿出10亿来做置换补贴，埃安车型限时置换补贴至高10万＋，小鹏G9限时减免两万，特斯拉Model Y将原先价值1.2万的星空灰车漆免费送，此外，就连新势力销冠问界也降了，新问界M7优惠两万，起售价降至22.98万元。车企们突如其来的“降价”举措像是商量好的，有观点认为，这波“降价”举措是小米SU7上市后销量大涨引发的冲击波，但其实不然，在竞争激烈的当下，每家车企其实都有本自家的账在算。不一样的“降价”方式4月初的这波优惠举措，尺度财经粗略统计，有十余家车企参与。从它们推出优惠举措的缘由来看，方式大致可以分为响应消费品以旧换新政策和限时优惠活动。比如蔚来，4月1日蔚来宣布为响应消费品以旧换新方案的号召，推出最高10亿元的油车置换补贴，即油车用户置换蔚来新车，将获得额外10000元的选装基金补贴，综合其他礼遇，总计最高可获得15000元的选装基金，此外还有NIO Phone抵用券以及换电券等权益。埃安也是类似的方式，但相比之下，埃安的优惠幅度更大。4月2日，埃安宣布针对旗下4款车型推出置换补贴，其中AION Y Plus限时置换优惠两万元，AION S Max和AION V Plus置换优惠均为2.6万元，而30万级的AION LX Plus限时置换优惠则达10万＋，可谓是降到了“地板价”。除了蔚来、埃安，像一汽-大众、一汽丰田、吉利、奇瑞等车企也几乎采用了相同的方式参与了这波“降价”。此外，还有一些车企没什么由头，直接就降，比如问界M7“降价”两万。值得注意的是，问界销量在刚刚过去的3月于新势力品牌中排行第一，再次蝉联月销量冠军。问界M7“降价”的消息并没有被官方大肆宣传，但“降价”确实得到了AITO客服的证实。客服人员表示，目前问界M7除了Plus四驱版没有权益以外，Plus后驱版、Max后驱智驾版、Max四驱智驾版都有相应权益。其中，Plus后驱版享有两万元的限时补贴，补贴后车价由原来的24.98万元降到22.98万元，此外该版本还享有1.2万元的内外饰选配权益。问界M7 Max后驱智驾版和Max四驱智驾版的权益基本相同，即1.2万元的内外饰选配、两万元的ADS智驾包抵扣金和一万元的智驾补贴，补贴后，两个版本车型的售价分别降至27.98万元和29.98万元。整体来看，问界M7在这一波价格调整后的区间在23万-30万元，与小米SU7的价格区间有一定重合。有意思的是，作为中大型SUV的小鹏G9当天也跟着“降价”了，根据小鹏G9限时优惠活动，购车立享智驾补贴，现车限时减免至高两万元，补贴后起售价降到24.39万元，另外小鹏G9还提供至高价值8000元的选装折扣以及配置打折权益。综合看下来，在传统的汽车销售淡季，车企们为了提振销量，真金白银补贴，也是拼了。家家有本账在算在车企们集体推出这波优惠举措之后，业内有观点认为，这是应对小米SU7上市的冲击，因为小米SU7上市，令整个汽车圈都为之震动，短短几天，小米SU7大定就超过10万单，而且极少有新车在上市后还有泼天的流量。难道是在狙击小米？我们注意到，此次车企们推出优惠举措的大多数产品和小米SU7都不是直接的竞争对手，尽管在价格带上有重叠，但车型类别、尺寸以及配置等都有明显差异，由此来看，众车企“降价”，并不是冲着小米来的。事实上，4月初的这波汽车“降价”并不是今年第一波，在此之前，比亚迪以“电比油低”的方式焕新产品变相降价，紧接着，五菱、长安启源、哪吒等品牌跟降，一连串的价格战就没有停过。新能源汽车发展至今，从头部车企的经历来看，规模和价格对于产品竞争十分重要，在车企迈向盈利的过程中，规模和价格也是相辅相成的。以问界为例，有分析认为，问界M7此次悄声“降价”意在获取更多销量。原因在于，问界今年以来持续热销，一季度销量已达到9.4万辆，同比增长374.8%，其中新问界M7属品牌最畅销车型，3月单月该车就交付了近2.5万辆，且自去年上市以来累计交付量已超12万辆。在此状态下，问界M7再将价格下探，或许该车的销量会进一步走高。此外，问界在去年底解决了M7产能跟不上的问题，据传余承东亲自“督战”，目标就是将M7月产能拉到2-3万。另外从目前M7下定到交付仅需两到四周的时间来看，M7的产能已经有所提升，在这一问题解决之后，加之M7价格下探，一定程度上说明问界对于销量规模的野心更大。据公开信息，AITO问界2024年的全年目标是60万辆，相比去年全年9.4万辆的战绩，今年销量目标可谓胃口不小。除了今年的新产品贡献销量以外，“降价”也将是问界的杀手锏。不止是问界，埃安此次优惠幅度之大也有“以价换量”的意味，前两年，埃安还是新能源销量排名TOP3选手，但是今年以来，其已被多个品牌赶超。数据显示，今年一季度埃安销量约为7.4万辆，同比下降7.7%，而全年目标是70万辆，很显然，埃安一季度仅完成目标约10%，压力不言而喻。整体来看，车企“降价”虽然是一窝蜂的跟进，但其实家家有本难念的经。平安证券研报分析，2024年头部新能源车企的增速面临压力，因此价格战将继续延续，随着电池成本的下降，车企还有更多的空间进行降价。对于新能源汽车价格战，你有何看法？欢迎在下方留言。,0,1,5.5,https://xueqiu.com/S/NIO
NIO,蔚来,2024/4/4 17:08, 活在当下志在远方,真心不明白蔚来的阿尔卑斯平台，60/90两款电池，60度这个年代就是残废。完全不知道怎么调研市场需求的，换电代替不了单次续航。,1,8,3,https://xueqiu.com/S/NIO
NIO,蔚来,2024/4/4 16:17, CandyMay,上海世纪汇小米旗舰店挤满了过来看小米SU7车的人，之前我写过上海世纪汇小米旗舰店缺少一辆小米汽车，(置顶在我的首页)今天过来看，如我所言，世纪汇小米旗舰店C位摆放的是镇店之宝，小米汽车在小米汽车没有上市之前，在很多人嘲笑雷军和小米汽车时，我表达的是我看好雷军这个人，以及小米的“人，家，车全生态战略”总结，我想要表达，继续表达和肯定我对小米的看好，因为雷军的营销在我看来全网第一顺便说下世纪汇小米旗舰店的边上，不到十米是蔚来的汽车展示区。蔚来和小米他们是好朋友。图片来自CandyMay@今日话题 @雪球创作者中心    @7X24快讯,6,2,6,https://xueqiu.com/S/NIO
NIO,蔚来,2024/4/4 16:13, jayfisher,以前以为是个车企，现在一看 市面上能山寨的都山寨完了， 最后一个也被雷军火速拿下，没盼头了， 就这样吧,0,0,2,https://xueqiu.com/S/NIO
NIO,蔚来,2024/4/4 13:24, Raines雷,蔚来或许会成为“反身性”的教科书案例：任何一个想买蔚来的潜在车主，一看股价跌成这副熊样，一定会开始三思自己的购买决策。,6,3,5,https://xueqiu.com/S/NIO
NIO,蔚来,2024/4/4 11:22, 美股滚雪球,历史上的月度表现看，5-7月比较强劲。小米,4,1,6.5,https://xueqiu.com/S/NIO
NIO,蔚来,2024/4/3 23:11, 祈福在春天,这么低的市值了,0,0,2,https://xueqiu.com/S/NIO
NIO,蔚来,2024/4/3 22:29, sqrt-1,大家觉得今年能看到2块的蔚来吗,4,10,5,https://xueqiu.com/S/NIO
NIO,蔚来,2024/4/3 22:23, 做点无趣的事,中概股是不是大多是中国人在炒。跟A股一样跌跌不休。,0,0,3,https://xueqiu.com/S/NIO
NIO,蔚来,2024/4/3 22:20, 金融界网站,4月3日，蔚来(NIO)盘中下跌2.53%，截至22:00，报4.43美元/股，成交4489.01万美元。财务数据显示，截至2023年12月31日，蔚来收入总额556.18亿人民币，同比增长12.89%；归母净利润-211.47亿人民币，同比减少45.25%。大事提醒：4月2日，蔚来获巴克莱重申评级Underweight，目标价下调至4美元。,0,0,5.5,https://xueqiu.com/S/NIO
NIO,蔚来,2024/4/3 22:04, CapJJJ,这么安静呢今天,0,0,9.5,https://xueqiu.com/S/NIO
NIO,蔚来,2024/4/3 21:50, 夏天老下雪,太过分了,0,0,2,https://xueqiu.com/S/NIO
NIO,蔚来,2024/4/3 20:45, 用户5818890307, 近日，由Billie Eilish、Nicki Minaj、Katy Perry和Camila Cabello等约200名音乐艺术家支持的艺术家权利联盟发布了一封公开信，呼吁数字音乐开发商“停止使用人工智能侵犯和贬低人类艺术家的权利”。 这场运动对AI开发者使用音乐作品发出了警告，这些开放平台未经版权方授权许可，大规模训练和制作AI“模仿品”，亦或者使用AI“声音”来稀释版税池，对音乐内容行业的健康发展产生了巨大的冲击。（回顾：从物理学到AIGC，Suno出现后做音乐还有前途吗？） 以下是公开信的内容： 我们，以下签名的艺术家和词曲创作社群的成员，呼吁AI开发者、科技公司、平台和数字音乐服务商停止使人工智能（AI）侵犯及贬低人类艺术家的权利。 不要误解：我们相信，负责任地使用这一技术，AI具有巨大的潜力来增进人类创造力，以推动发展和增长的方式，为世界各地的乐迷带来全新的、令人兴奋的体验。 不幸的是，一些平台和开发者正在使用AI去损害创造力并削弱艺术家、词曲作者、音乐家和版权所有者的利益。 不负责任地使用AI，就会对我们的隐私保护、我们的人格身份、我们音乐创作和我们的生计构成巨大威胁。一些最大和最强的公司，未经许可，使用我们的作品来训练AI模型。这些行为的直接目的，是用海量的AI所创造的“声音”和“图像”取代人类艺术家的作品，从而极大地稀释支付给艺术家的版税池。对于许多努力维持生计的音乐家、艺术家和词曲作者来说，这将是灾难性的。 如果不加以控制，AI将触发向低标准竞争的滑坡，降低我们作品价值的同时，也会阻止我们获得合理的报酬。 这种对人类创造力的攻击必须停止。我们必须防止AI的掠夺性使用，它们窃取专业艺术家的声音和形象，侵犯创作者的权利，摧毁音乐行业生态。 我们呼吁所有AI开发者、科技公司、平台和数字音乐服务商承诺，他们不会开发或部署那些削弱或取代由艺术家和词曲作者所代表的人类创造力的AI音乐生成技术、内容或工具，也不会拒绝为我们的作品提供合理的报酬。  图源：好莱坞报道 以下是签署公开信艺术家完整名单： Agus Martino Aimee Mann Ali McGuirk Alice Randall Alisa Amador António Zambujo Arkells Ashley Shabankareh Astrid Astronomía Interior Aya Ayra Starr Banda Carnaval Banda El Recodo de Don Cruz Lizárraga Banda Los Recoditos BENEE Benny the Butcher Bia Marques Bianca Big Up Billie Eilish Billy Porter Black Spygo estate of Bob Marley Brandi Waller-Pace Brian Folkins-Amador Brothers Osborne Brunno Ramos Bryan Behr Bryan Martinez Budah Buddy Miller CAKE Calema Calibre 50 Callie Khouri Caloncho Calum Scott Cami Camila Cabello Canals Carl?o Carol Biazin Carolina Deslandes Cedella Marley Cedric Singleton Chappell Roan Chase & Status Chega mais pra Cristo Chelsea Cutler Chesca Chuck D Ciph Boogie Clotilde Rullaud Coey Redd Colin Linden Crys Matthews Czarface d4vd Dan Ferrera Dan Knobler Dan Navarro Dan Smith Daniel Martin Moore Daniel Quién Daniela Spalla Danna Paola Darius Rucker Dave East David Lowery Declan Sheehy-Moss Delacey Diana Krall Diogo Pi?arra Doce Encontro Doechii Don Was Dylan LeBlanc East Forest Ela Taubert Eli Soares Elvis Costello Em Beihold Emiliano Fernández Emily Scott Robinson Engelbert Humperdinck Enkay47 Erin McKeown Espinoza Paz Felipe Araújo Fernando Daniel FINNEAS FLETCHER estate of Frank Sinatra Gavin Gray Gonzy Greta Van Fleet Gretchen Peters Grupo CA?AVERAL Grupo Recluta Hit-Boy Hugo & Vitor HYBE IMAFE Music Imagine Dragons Ivan Barias Iván Conejo J Balvin J Gonz Ja Rule Jacinto Jadakiss Jamie Cullum Jana Herzen Jannek Zechner Jason Isbell Jason Lindner Javy Hustle Jean Rohe Jeremy Zucker Jess Glynne Jim Jones Joaquina John Paul White Jon Batiste Jon Bon Jovi Jonas Brothers Jonathan Taplin Jordan Rakei Juan Marcus & Vinicius Juan Pablo Contreras Juanes Julia Michaels Kacey Musgraves Kaio Viana Kart Love Kate Hudson Katy Perry Kevin Aguilar Kid Pistola Kim Petras La ArrolladoraBanda El Limón deRené Camacho Lasso Lauana Prado Laura Burhenn Laura Veirs Lee Lewis Lera Lynn Lola índigo Lola Young Lou Garcia Loudon Wainwright III Lua Lacruz Luciano Pereyra Luis Fonsi Luz Casal Lynne Hanson Mac DeMarco Maggie Vail Maneva Manuel Carrasco Mar.iana Marc Cohn Marcus King Marian Hill Marisa Liz Mark Erelli Mary Gauthier estate of Mary Wilson Matheus Matthew Montfort Maxx Kreative Mayra Mel Granda Merca Xin Corte Mergui Metro Boomin Mia Salinas Michael Penn Michelle Branch Mikael Eldridge Miko Marks Miranda Lambert Mumford & Sons Mumuzinho Nanno Natalie Jean Nesk Only Nick Howard Nicki Minaj Noah Kahan Norah Jones Olivia Wald Oney1 Dr. Otis Williams Patrick Carney Pearl Jam Pedro Abrunhosa Peter Case Peter Frampton Planta Q-Tip Raphael Regis Danese Reins R.E.M. Remi Wolf Rhett Miller Robert Finkelstein Robert Smith Rodney Crowell Ron Pope Rosanne Cash Rosi Amador Rui Massena Ryan Tedder Sam Smith SER Sérgio Godinho Sherlyn Sánchez Sheryl Crow Sigrid Simone Mendes Smokey Robinson Stevland Morris agreeson behalf of himself andStevie Wonder T Bone Burnett T-Rex Taylor Díaz Tech N9ne The Last Dinner Party Tift Merritt Tina Sinatra Traci Thomas Trucha Valentina Fernandez Vivir Quintana WD Will Linley Windser Yard Act Yo Gambii Zayn Malik,0,0,5,https://xueqiu.com/S/NIO
NIO,蔚来,2024/4/3 20:35, 用户6782472804,每天都是新低，蔚来已完,0,0,2,https://xueqiu.com/S/NIO
NIO,蔚来,2024/4/3 19:50, 亿欧网,这可能是余承东和华为鸿蒙系汽车品牌最紧张的时刻。3月28日，随着雷军宣布小米首款车型SU7正式上市，巨大的破圈效应让市场瞬间沸腾了，甚至在大海另一边的汽车强国日本都感受到了小米的冲击。“小米汽车如同iPhone问世。”作为日本著名的市场调研机构，伊藤忠总研的主任研究员深尾三四郎对小米SU7毫不吝惜赞美之词：“就像乔布斯发布第一代iPhone时一样，我感到十分震惊。苹果放弃了Apple Car构想，而小米代替苹果打造了智能手机和EV相结合的生态系统。站在竞争对手的角度来说，简直无机可乘。”对于小米的老对手且更早布局汽车业务的华为来说，手握鸿蒙生态的余承东绝对不会接受“无机可乘”的结果。“大批新智界S7已经离开产线，正在发往交付给用户的路上。”3月30日，余承东宣布智界S7开启大规模交付。作为鸿蒙智行的首款轿车，有着鸿蒙生态加持的智界S7早在2023年11月就已经上市。但是因为交付问题，智界S7的市场销量和舆论流量都已经大不如昔。所以，余承东并没有把希望全部押注在智界S7上。作为现在华为四界中知名度最响和销量最高的品牌，4月1日，问界宣布新M7开启降价模式。虽然问界M7属于SUV，和小米SU7并不在同一个细分市场，但是正所谓“多生孩子好打架”，在智界S7声量太小的情况下，让新问界M7顶上也无可厚非。事实上，面对小米SU7上市后的泼天流量，各家车企都拿出了应对之策，选择降价应对的品牌也绝对不止问界一家。蔚来汽车推出了最高10亿元油车置换补贴，小鹏汽车则宣布G9限时减免至高2万元，甚至还有特斯拉Model Y涨价5000元的反向催单骚操作。然而，真正受益于小米SU7上市的品牌可能出乎所有人的意料――极氪，迎来了泼天的富贵。考验小米产能的时候到了“小米SU7开售短短几天时间，就有了超过10万人大定，锁单量已经超过4万单。”4月3日，雷军在小米SU7交付仪式上给出了订单数量的官方数据，外界最关心的小米SU7销售情况终于尘埃落定。但是销量的火爆也带来了新的问题，那就是产能。据亿欧汽车了解，4月2日，小米SU7三个版本的交付周期基本都在20周以上。其中，标准版20至33周，Pro版19至22周，Max的交付周期最为夸张，需要28至31周，这意味着消费者现在锁单小米SU7 Max版本，要等到年底才能提车。相比之下，特斯拉Model 3和Y全系交付周期都在2至6周，Model 3的部分车型甚至还有现车。据悉，小米汽车此前计划3月产量3000辆，4月攀升到4000辆以上，然后稳定在6000辆每个月，但是SU7上市后的火爆状态让小米汽车要求供应商尽快将产能提高到1万辆/月，Max版本更是产能提高的重点对象。小米要想成为全球前五汽车厂商，还得先过产能这关 图源：网络“前方紧吃，后方吃紧。”这可以说是小米汽车销售端和产能侧的真实写照。面对泼天的订单数量和关注度，小米汽车对于产能和交付的紧张并非杞人忧天。因为在造车新势力企业中，确实有因为交付周期过长导致订单大量流失的先例可循。2023年，蔚来总裁秦力洪在谈及新车上市和交付节奏问题时候就表示，蔚来并不是从发布到交付一定要半年以上，过去两年疫情和供应链的情况让有些事情变得复杂。NIO Day的时间相对固定，也造成了新车在NIO Day发布后交付时间有时过长，最长的ET7从发布到交付可能超过一年。在这种漫长的等待过程中，消费者们终于失去了对蔚来的耐心，ET7的销量也一落千丈。为了避免重蹈覆辙，在全新ES6上市时，蔚来大幅优化了产品上市效率，做到了上市即交付，这让全新ES6在上市首月的交付量就超过1万辆，创造了蔚来单车型月度交付量纪录。为了躲开蔚来踩过的坑，小米汽车官方也在4月3日亲自对产能和交付问题做出回应，目前小米汽车工厂全力以赴提高产能，并充分动员供应链伙伴全力保供，稳定推进现有订单的尽快交付、未来订单的有序处理，保障用户的交付体验。汹涌而来的订单量让小米汽车内部正在全力以赴突破产能瓶颈。在外部，小米汽车的对手们也已经做好了应战准备。余承东坐不住了在3月28日的小米SU7上市发布会上，受到媒体关注的并不仅仅只有雷军，坐在台下的李斌、李想、何小鹏、魏建军以及新上任的北汽集团党委书记、党委书记张建勇也受到了格外关注。面对小米SU7发布会期间的超高热度，不少网友也创作了各种梗图调侃他们的内心状态。但是相比于坐在场下的5位高管，没有参加这场发布会的余承东可能才是那个坐不住的人。因为和华为鸿蒙的首款轿车智界S7相比，小米SU7和前者的定位实在是太接近了。两台车几乎都是典型的“532”轿车，即车长接近5米，轴距接近3米，起售价在20万元出头，而且两款车都是纯电轿车且主打智能化。更重要的是，和传统车企与新势力没有生态加持不同，小米生态对SU7提供了巨大的生态赋能，这让鸿蒙生态遇到了真正的对手。但是，本来占据先发优势的智界S7却踩到了蔚来ET7踩过的雷――产能地狱。余承东曾经公开表示，智界S7预发布仅两天，预订量就超过了一万辆，比问界新M7同期的势头还猛。但是因为芯片短缺和工厂搬迁，智界S7在产能爬坡上浪费了大量时间。产能地狱的出现让智界S7的市场表现受到了巨大冲击，销量上始终没有起色。从2023年11月至2024年2月，累计销量只有2297辆，单月销量从未突破800辆。但是面对小米SU7的泼天流量和海量订单，余承东并未选择坐以待毙，特别是小米SU7似乎也遇到了产能问题时，余承东选择果断出手。在小米SU7上市的一天以后，余承东在个人微博上表示，华为与奇瑞汽车合作打造的智界S7将开启大规模交付。同时，华为方面还放出风声，智界S7将在4月重新发布并可能对产品细节做出调整。除了加速交付和重新发布智界S7之外，余承东还有一个Plan B，那就是让销量更大且体系更成熟的问界也冲上火线，迎战方式也极为简单粗暴――降价！同样在4月1日，问界下调了新M7入门版车型的价格――M7 Plus大五座后驱版售价下调2万至22.98万元。如此一来，新M7和小米SU7的起售价基本就在同一起跑线了。而且相比于智界S7，问界并不存在产能问题，这也让问界面对小米SU7时占据了交付优势。就在余承东率领问界和智界奋起迎战小米SU7时，吉利旗下的极氪汽车却有望成为小米SU7上市的赢家。订单暴涨，李书福笑了雷军宣布小米将要造车后，吉利与小米之间的纷争最为跌宕起伏（请阅前文：群殴小米，吉利带头）。所以，面对小米SU7的上市，吉利旗下的极氪、领克和银河等品牌早早就做好了产品和价格上的布局。吉利控股集团董事长李书福甚至亲自下场，在3月28日下午，也就是小米发布会前夕和新东方创始人、东方甄选CEO俞敏洪做了一场直播。似乎是为了展现吉利的“生态”实力，在这场直播中，李书福邀请俞敏洪到吉利未来出行星座第三轨卫星发射现场，并送给俞敏洪一颗台州产的卫星――东方甄选号。李书福还表示，吉利将持续推动汽车、手机、卫星深度融合，为用户打造一个更安全省心、更智能便捷的未来出行生态。虽然吉利和小米的生态并不相同，但在汽车这个共同的战场上，两家的恩怨情仇终于迎来了正面对决的时刻。然而，就在外界以为小米SU7将凭借“流量黑洞”将吉利系各大品牌打翻在地之时，极氪却完成了逃出生天。今年2月，极氪赶在小米SU7上市前一个月完成了全新极氪001的上市工作，虽然都是“532”车型，但是全新极氪001的起售价在26.9万元且全系标配800V高压系统。这一价格刚好处于小米SU7 Pro版（24.59万元）和Max版（29.99万元）之间，而且这两个版本中只有Max版本配备了800V高压系统，这让全新极氪001极具性价比。3月30日，就在余承东表示智界S7开启大规模交付的同时，极氪宣布全新极氪001在当天收获订单2000辆。3月31日，这一数字又攀升至2500辆。据悉，在小米SU7上市以后，部分长期观望全新极氪001和小米SU7的客户终于开始下定极氪001。从3月22日至28日，全新极氪001订单达到创纪录的9000辆，这也让全新极氪001上市后首月累计大定突破3万辆。和余承东的选择相似，极氪也并没有将全部筹码压在全新极氪001身上，极氪也有自己的Plan B――极氪007。4月1日，极氪宣布推出起售价20.9万元的极氪007后驱增强版，比小米SU7的起售价21.59万元低了近1万元，极氪希望以更低的价格争夺小米SU7标准版的意图已经不言自明。而在价位更高的市场，全新极氪001在性能和配置上也完全不逊于小米SU7 Pro和Max版。出色的产品布局让吉利在和小米的第一回合较量中不落下风，但是正所谓路遥知马力，SU7只是小米的第一款产品，而且凭借着小米生态的优势，极氪在内的吉利系还不能掉以轻心，中国智能电动汽车市场的淘汰赛才刚刚拉开大幕。,1,0,5.5,https://xueqiu.com/S/NIO
NIO,蔚来,2024/4/3 18:22, 森林光束, 网页链接有没有专业的大佬来科普下,0,0,3,https://xueqiu.com/S/NIO
